{"requirementId":"REQ-27","analysisFile":"/Users/hishamel-husseini/Documents/projects/raffle-fun/audits/2026-10-21-r001/runs/DAYBREAK-TOB/attempt-03/artifacts/stages/05-spec-compliance/requirements/REQ-27.md","verdict":"implemented","confidence":"high","evidence":[{"file":"target/packages/contracts/src/Raffle.sol","lines":"L223-L233","quote":"uint256 grossAmount = uint256(entryCount) * ENTRY_PRICE; ... unsettledPot += grossAmount;","role":"Accumulates every purchase into one aggregate gross pot."},{"file":"target/packages/contracts/src/Raffle.sol","lines":"L539-L555","quote":"uint256 protocolFee = Math.mulDiv(grossPot, RaffleConstants.PROTOCOL_FEE_BPS, RaffleConstants.BPS); ... sponsorAmount = grossPot - protocolFee - cashAmount; ... protocolFees = protocolFee;","role":"Calculates one aggregate fee before branching and assigns all residual units to sponsor proceeds."},{"file":"target/packages/contracts/node_modules/@openzeppelin/contracts/utils/math/Math.sol","lines":"L199-L216","quote":"Calculates floor(x * y / denominator) with full precision. ... return low / denominator;","role":"Establishes that the invoked three-argument mulDiv overload rounds down."},{"file":"target/packages/contracts/src/libraries/RaffleConstants.sol","lines":"L11-L18","quote":"uint256 internal constant BPS = 10_000; ... uint256 internal constant PROTOCOL_FEE_BPS = 500; ... uint256 internal constant CASH_WINNER_BPS = 8000;","role":"Fixes the denominator and allocation rates."},{"file":"target/packages/contracts/src/Raffle.sol","lines":"L468-L470","quote":"amount = unsettledPot + remainingRefundLiability + winnerProceeds + sponsorProceeds + protocolFees;","role":"Accounts for every allocated quote-token bucket."}],"searched":[{"where":"All five production files and all 31 dependency-hashes.json entries","result":"36 scoped files searched; all 31 dependency SHA-256 values matched the manifest."},{"where":"protocolFee|protocolFees|PROTOCOL_FEE_BPS","result":"21 matched tokens across three files; only Raffle.sol:L540 calculates the quote-token protocol fee."},{"where":"unsettledPot writers","result":"Exactly three: purchase accumulation at L233, refund clearing at L297, and settlement clearing at L553."},{"where":"_settleWinningTicket(","result":"Three hits: direct caller L305, lazy-redemption caller L315, and private implementation L533; no alternate implementation."},{"where":"protocolFees assignments","result":"Two hits: settlement allocation at L555 and claim clearing at L388; no alternate fee writer."},{"where":"commission|platform|house|cut","result":"0 hits in the five production files."},{"where":"Constructors, clone path, base contracts, modifiers, terminal branches, refund branch, and release paths","result":"No bypass, second protocol-fee formula, or unallocated residual bucket found."}],"reasoning":"Both settlement entrypoints converge on one private routine that computes the protocol fee once from the aggregate unsettled pot. The invoked three-argument Math.mulDiv implementation explicitly floors the full-precision quotient. Both NftWon and CashWon then derive sponsor proceeds by subtraction from the same gross pot, so winner plus sponsor plus protocol liabilities equal the original pot exactly. This is implemented rather than partial or contradicted because every fee-bearing branch shares that calculation and no alternate writer or formula exists.","documentProblem":null}