{"requirementId":"REQ-04","analysisFile":"/Users/hishamel-husseini/Documents/projects/raffle-fun/audits/2026-10-21-r001/runs/DAYBREAK-TOB/attempt-03/artifacts/stages/05-spec-compliance/requirements/REQ-04.md","verdict":"implemented","confidence":"high","evidence":[{"file":"target/packages/contracts/src/RaffleFactory.sol","lines":"L89-L91","quote":"address implementation = address(new Raffle(quoteToken_, vrfWrapper_));\nif (protocolTreasury_ == implementation) revert UnsafeProtocolDestination(protocolTreasury_);\nraffleImplementation = implementation;","role":"Deploys one concrete implementation and fixes it in the factory immutable."},{"file":"target/packages/contracts/src/RaffleFactory.sol","lines":"L105-L107","quote":"uint256 raffleId = ++raffleCount;\nraffle = Clones.clone(raffleImplementation);","role":"Every canonical creation passes the fixed implementation to the clone builder."},{"file":"target/packages/contracts/node_modules/@openzeppelin/contracts/proxy/Clones.sol","lines":"L51-L57","quote":"assembly (\"memory-safe\") {\n    // Cleans the upper 96 bits of the `implementation` word, then packs the first 3 bytes\n    // of the `implementation` address with the bytecode before the address.\n    mstore(0x00, or(shr(232, shl(96, implementation)), 0x3d602d80600a3d3981f3363d3d373d3d3d363d73000000))\n    // Packs the remaining 17 bytes of `implementation` with the bytecode after the address.\n    mstore(0x20, or(shl(120, implementation), 0x5af43d82803e903d91602b57fd5bf3))\n    instance := create(value, 0x09, 0x37)\n}","role":"Embeds the full implementation address into the deployed ERC-1167 runtime bytecode."}],"searched":[{"where":"All five production files and all 31 dependency-hashes.json entries","result":"Read in full; all 31 dependency hashes matched the manifest."},{"where":"raffleImplementation in production","result":"7 hits; exactly 1 assignment at RaffleFactory.sol:L91 and 1 clone argument at L106."},{"where":"Clone-family invocations in production","result":"1 hit: Clones.clone(raffleImplementation) at RaffleFactory.sol:L106; no alternate clone path."},{"where":"Upgrade, implementation-slot, delegatecall, and destruction vocabulary","result":"No operational production hits; selfdestruct/suicide returned 0 hits across all 36 scoped files. Dependency hits were only generic uncalled utilities or documentation."}],"reasoning":"The factory constructor fixes one directly deployed Raffle address, the sole canonical creation path passes it to OpenZeppelin's ERC-1167 builder, and that builder embeds the target in runtime bytecode instead of consulting writable storage. All failure branches revert, initialization has no implementation field, and no retargeting path exists.","documentProblem":null}