{"requirementId":"REQ-14","analysisFile":"/Users/hishamel-husseini/Documents/projects/raffle-fun/audits/2026-10-21-r001/runs/DAYBREAK-TOB/attempt-03/artifacts/stages/05-spec-compliance/requirements/REQ-14.md","verdict":"partial","confidence":"high","evidence":[{"file":"target/packages/contracts/src/RaffleFactory.sol","lines":"L97-L147","quote":"prize.safeTransferFrom(msg.sender, raffle, params.prizeTokenId);","role":"Performs one nominal prize transfer, verifies token-reported ownership and Active status, then publishes creation."},{"file":"target/packages/contracts/src/Raffle.sol","lines":"L176-L205","quote":"prizeToken = IERC721(params.prizeToken);\nprizeTokenId = params.prizeTokenId;","role":"Stores exactly one scalar prize pair during factory-only, one-time initialization."},{"file":"target/packages/contracts/src/Raffle.sol","lines":"L416-L430","quote":"status != Status.AwaitingPrize || msg.sender != address(prizeToken) || tokenId != prizeTokenId\n                || from != sponsor || operator != factory","role":"Restricts activation to one exact callback tuple and makes the gate one-shot by setting Active."},{"file":"target/packages/contracts/src/RaffleFactory.sol","lines":"L154-L185","quote":"try IERC165(params.prizeToken).supportsInterface(type(IERC721).interfaceId) returns (bool supported)","role":"Gap: arbitrary prize code is admitted using code presence and its self-reported interface support."},{"file":"target/packages/contracts/node_modules/@openzeppelin/contracts/token/ERC721/IERC721.sol","lines":"L39-L55","quote":"function ownerOf(uint256 tokenId) external view returns (address owner);","role":"Only an interface declaration governs the sponsor-selected token; no concrete prize implementation is present."}],"searched":[{"where":"Five production files and all 31 dependency-hashes.json entries","result":"Read in full; all 31 dependency SHA-256 values matched."},{"where":"createRaffle|CreateRaffle","result":"4 production hits, 0 dependency hits; no alternate creation wrapper or caller."},{"where":"initialize\\(","result":"3 production hits, 0 dependency hits: interface, sole factory call, and implementation."},{"where":"safeTransferFrom","result":"2 production hits, 15 dependency hits; only RaffleFactory.sol:L128 deposits the prize."},{"where":"onERC721Received","result":"2 production hits, 13 dependency hits; one production receiver and its returned selector."},{"where":"ownerOf","result":"5 production hits, 9 dependency hits; only RaffleFactory.sol:L129 checks creation-time prize custody."},{"where":"prizeToken/prizeTokenId assignments","result":"Exactly one assignment to each, at Raffle.sol:L200-L201."},{"where":"Concrete sponsor-selected ERC721 implementation","result":"None in scope; only interfaces, the generic OpenZeppelin abstract implementation, and Raffle's ticket inheritance."}],"reasoning":"The conforming-token path atomically configures and transfers one prize, rejects duplicate callbacks, checks ownership/status, and emits creation only afterward. However, validation accepts code based on its own ERC-165 response, while activation and custody rely on callback fields and ownerOf reported by that same external contract. An accepted self-reporting contract can therefore let creation succeed without enforceable NFT custody. The invariant holds on the conforming path but not every accepted path, making it partial rather than implemented or contradicted.","documentProblem":null}