{"requirementId":"REQ-29","analysisFile":"/Users/hishamel-husseini/Documents/projects/raffle-fun/audits/2026-10-21-r001/runs/DAYBREAK-TOB/attempt-03/artifacts/stages/05-spec-compliance/requirements/REQ-29.md","verdict":"implemented","confidence":"high","evidence":[{"file":"target/packages/contracts/src/RaffleFactory.sol","lines":"L33-L42, L85-L91, L106","quote":"address public immutable override quoteToken;\naddress public immutable override vrfWrapper;\naddress public immutable override protocolTreasury;\naddress public immutable override raffleImplementation;","role":"Protocol dependencies and the sole clone implementation are constructor-set immutables."},{"file":"target/packages/contracts/src/Raffle.sol","lines":"L176-L205","quote":"if (initialized) revert AlreadyInitialized();\nif (msg.sender != factory) revert OnlyFactory();\ninitialized = true;","role":"Clone configuration has one factory-only initialization pass and no later write path."},{"file":"target/packages/contracts/node_modules/@openzeppelin/contracts/proxy/Clones.sol","lines":"L47-L62","quote":"mstore(0x20, or(shl(120, implementation), 0x5af43d82803e903d91602b57fd5bf3))\ninstance := create(value, 0x09, 0x37)","role":"The ERC-1167 clone bytecode embeds its implementation target."},{"file":"target/packages/contracts/src/Raffle.sol","lines":"L276-L300","quote":"if (msg.sender != sponsor && block.timestamp < deadline) {\n    revert RefundsNotAvailable(deadline, block.timestamp);\n}","role":"The strongest address-specific control is limited to early cancellation of a raffle with zero sold entries."}],"searched":[{"where":"Five production files and all 31 files in target/dependency-hashes.json","result":"Read in full; all 31 dependency SHA-256 values matched."},{"where":"Administrator/role vocabulary and privileged-mutator declarations","result":"One NatSpec-only administrator hit; 0 executable administrator constructs and 0 privileged mutator declarations."},{"where":"Protocol configuration assignments","result":"14 hits, all confined to RaffleFactory construction or Raffle one-time initialization."},{"where":"Upgrade, implementation-slot, delegatecall, and destructive-opcode vocabulary","result":"No reachable upgrade path: implementation-slot references are an unused documentation example, dynamic delegatecall helpers have no callers, and selfdestruct/suicide/callcode returned 0 hits."},{"where":"Caller gates, modifiers, inherited ERC721 authorization, and VRF callback authentication","result":"Every relevant branch was walked; restrictions are initialization, callback, ticket-ownership, or empty-raffle sponsor authorities, not general administration."}],"reasoning":"The factory fixes every protocol-wide target and its sole implementation at construction; clone-specific configuration is factory-only and one-time; canonical ERC-1167 clones embed that immutable implementation. All restricted paths are narrowly functional, including sponsor cancellation only while no entries exist. No owner/role machinery, configuration setter, pause/rescue surface, mutable implementation slot, or reachable arbitrary delegatecall exists, so no branch supports a partial or contradicted verdict.","documentProblem":null}